{"all_decisions_match":true,"all_errors_match":true,"by_dimension":{"alias-conflict":{"accuracy":{"denominator":3,"numerator":3,"value":1.0},"admit_recall":{"denominator":0,"numerator":0,"value":null},"false_admit":0,"false_reject":0,"reject_precision":{"denominator":3,"numerator":3,"value":1.0},"reject_recall":{"denominator":3,"numerator":3,"value":1.0},"true_admit":0,"true_reject":3},"baseline":{"accuracy":{"denominator":11,"numerator":11,"value":1.0},"admit_recall":{"denominator":11,"numerator":11,"value":1.0},"false_admit":0,"false_reject":0,"reject_precision":{"denominator":0,"numerator":0,"value":null},"reject_recall":{"denominator":0,"numerator":0,"value":null},"true_admit":11,"true_reject":0},"distinct-resource":{"accuracy":{"denominator":7,"numerator":7,"value":1.0},"admit_recall":{"denominator":7,"numerator":7,"value":1.0},"false_admit":0,"false_reject":0,"reject_precision":{"denominator":0,"numerator":0,"value":null},"reject_recall":{"denominator":0,"numerator":0,"value":null},"true_admit":7,"true_reject":0},"mediation":{"accuracy":{"denominator":3,"numerator":3,"value":1.0},"admit_recall":{"denominator":1,"numerator":1,"value":1.0},"false_admit":0,"false_reject":0,"reject_precision":{"denominator":2,"numerator":2,"value":1.0},"reject_recall":{"denominator":2,"numerator":2,"value":1.0},"true_admit":1,"true_reject":2},"missing-capability":{"accuracy":{"denominator":1,"numerator":1,"value":1.0},"admit_recall":{"denominator":0,"numerator":0,"value":null},"false_admit":0,"false_reject":0,"reject_precision":{"denominator":1,"numerator":1,"value":1.0},"reject_recall":{"denominator":1,"numerator":1,"value":1.0},"true_admit":0,"true_reject":1},"mode-conflict":{"accuracy":{"denominator":2,"numerator":2,"value":1.0},"admit_recall":{"denominator":0,"numerator":0,"value":null},"false_admit":0,"false_reject":0,"reject_precision":{"denominator":2,"numerator":2,"value":1.0},"reject_recall":{"denominator":2,"numerator":2,"value":1.0},"true_admit":0,"true_reject":2},"provider-ambiguity":{"accuracy":{"denominator":1,"numerator":1,"value":1.0},"admit_recall":{"denominator":0,"numerator":0,"value":null},"false_admit":0,"false_reject":0,"reject_precision":{"denominator":1,"numerator":1,"value":1.0},"reject_recall":{"denominator":1,"numerator":1,"value":1.0},"true_admit":0,"true_reject":1},"shared-provider":{"accuracy":{"denominator":1,"numerator":1,"value":1.0},"admit_recall":{"denominator":1,"numerator":1,"value":1.0},"false_admit":0,"false_reject":0,"reject_precision":{"denominator":0,"numerator":0,"value":null},"reject_recall":{"denominator":0,"numerator":0,"value":null},"true_admit":1,"true_reject":0},"shared-read":{"accuracy":{"denominator":1,"numerator":1,"value":1.0},"admit_recall":{"denominator":1,"numerator":1,"value":1.0},"false_admit":0,"false_reject":0,"reject_precision":{"denominator":0,"numerator":0,"value":null},"reject_recall":{"denominator":0,"numerator":0,"value":null},"true_admit":1,"true_reject":0},"unknown-resource":{"accuracy":{"denominator":1,"numerator":1,"value":1.0},"admit_recall":{"denominator":0,"numerator":0,"value":null},"false_admit":0,"false_reject":0,"reject_precision":{"denominator":1,"numerator":1,"value":1.0},"reject_recall":{"denominator":1,"numerator":1,"value":1.0},"true_admit":0,"true_reject":1}},"case_count":31,"classification":"modeled-static-contract-corpus","decisions_sha256":"d3c77c0aaf36f93f98e13de1b1d08c2d7aeb926a6be1b953018d9c642d5abef9","degenerate_baselines":{"admit-all":{"accuracy":{"denominator":31,"numerator":21,"value":0.677419},"admit_recall":{"denominator":21,"numerator":21,"value":1.0},"false_admit":10,"false_reject":0,"reject_precision":{"denominator":0,"numerator":0,"value":null},"reject_recall":{"denominator":10,"numerator":0,"value":0.0},"true_admit":21,"true_reject":0},"reject-all":{"accuracy":{"denominator":31,"numerator":10,"value":0.322581},"admit_recall":{"denominator":21,"numerator":0,"value":0.0},"false_admit":0,"false_reject":21,"reject_precision":{"denominator":31,"numerator":10,"value":0.322581},"reject_recall":{"denominator":10,"numerator":10,"value":1.0},"true_admit":0,"true_reject":10}},"generator":"ecpa-l2-evaluator/0.1","implementation":{"contract_compiler_sha256":"09bc6b3c33bf613bd0003f3521d92e60c6bd299519b2661aaa8c32ae35b40c57","evaluator_sha256":"ed4c346009e2c9f91c537db27cd6235ef744bd57e5d9fa9e247cc0c87fae0d86"},"inputs":{"cases_sha256":"4660fb83ff42aaf3bdfc2fae0f3306c275fc1028c87eff390319e77ec253537a","oracle_sha256":"06de27ae23c99db674d0d145d86ec1aff846c4b00c46b86227e412b4ac2ad99e","source_corpus_sha256":"764f462052264333abdefeba09ef28e7afcfbcbb377c7c4c221def862e85c077","taxonomy_sha256":"4ce872bb430365de198a1c74129da981e826601f58750dd15497b637cc3321b9"},"oracle":{"artifact_review_commit":"ed248e12df24695bb0ddf2bb90acebf529e937f8","content_review_commit":"4a87f99d47b7e0bf87a58417ba1bfb372344c22a","sha256":"06de27ae23c99db674d0d145d86ec1aff846c4b00c46b86227e412b4ac2ad99e"},"overall":{"accuracy":{"denominator":31,"numerator":31,"value":1.0},"admit_recall":{"denominator":21,"numerator":21,"value":1.0},"false_admit":0,"false_reject":0,"reject_precision":{"denominator":10,"numerator":10,"value":1.0},"reject_recall":{"denominator":10,"numerator":10,"value":1.0},"true_admit":21,"true_reject":10},"reject_error_code_accuracy":{"denominator":10,"numerator":10,"value":1.0},"schema":"ecpa-contract-planner-results/0.1"}
